{
    "$schema": "./index.schema.json",
    "formatVersion": 2,
    "name": "uBot",
    "packages": [
        {
            "name": "UBotCore",
            "friendlyName": "uBot Core",
            "description": {
                "en": "Frame header, sim clock, coordinate conventions between UE and right-handed SI, shared interfaces and package management.",
                "zh-CN": "帧头、仿真时钟、UE 与右手系 SI 之间的坐标约定、通用接口与 Package 管理。"
            },
            "layer": "Foundation",
            "repository": "https://github.com/AstreoX/uBotCore.git",
            "docsUrl": "https://github.com/AstreoX/uBotCore",
            "tags": [ "core" ],
            "versions": [
                {
                    "version": "0.1.0",
                    "ref": "v0.1.0",
                    "engine": "~5.5",
                    "requires": [],
                    "enginePlugins": [],
                    "provides": [
                        "Core.FrameHeader",
                        "Core.Clock",
                        "Core.Conventions.ROS",
                        "Core.Interfaces",
                        "Core.PackageManager"
                    ]
                },
                {
                    "version": "0.1.1",
                    "ref": "v0.1.1",
                    "engine": "~5.5",
                    "requires": [],
                    "enginePlugins": [],
                    "provides": [
                        "Core.FrameHeader",
                        "Core.Clock",
                        "Core.Conventions.ROS",
                        "Core.Interfaces",
                        "Core.PackageManager"
                    ],
                    "binaries": {
                        "5.5": {
                            "Win64": {
                                "url": "https://github.com/AstreoX/uBotCore/releases/download/v0.1.1/UBotCore-0.1.1-UE5.5-Win64.zip",
                                "sha256": "13c7989175dfe56703bf5928a4ce2fe64d8140617af2d6eb20c29b436b7aca7b",
                                "size": 915219
                            }
                        }
                    }
                },
                {
                    "version": "0.1.2",
                    "ref": "v0.1.2",
                    "engine": "~5.5",
                    "requires": [],
                    "enginePlugins": [],
                    "provides": [
                        "Core.FrameHeader",
                        "Core.Clock",
                        "Core.Conventions.ROS",
                        "Core.Interfaces",
                        "Core.PackageManager"
                    ],
                    "binaries": {
                        "5.5": {
                            "Win64": {
                                "url": "https://github.com/AstreoX/uBotCore/releases/download/v0.1.2/UBotCore-0.1.2-UE5.5-Win64.zip",
                                "sha256": "30053fd519fb4f7370cd86906fed66ae718837b3cebcc5c3592af5fe37609a9a",
                                "size": 1123439
                            }
                        }
                    }
                },
                {
                    "version": "0.1.3",
                    "ref": "v0.1.3",
                    "requires": [],
                    "enginePlugins": [],
                    "provides": [
                        "Core.FrameHeader",
                        "Core.Clock",
                        "Core.Conventions",
                        "Core.Interfaces",
                        "Core.PackageManager"
                    ]
                }
            ]
        },
        {
            "name": "UBotSensor",
            "friendlyName": "uBot Sensor",
            "description": {
                "en": "Pose, IMU, odometry, 2D/3D lidar, RGB and depth cameras.",
                "zh-CN": "位姿、IMU、里程计、2D/3D 激光雷达、RGB 与深度相机。"
            },
            "layer": "Capability",
            "repository": "https://github.com/AstreoX/uBotSensor.git",
            "docsUrl": "https://github.com/AstreoX/uBotSensor",
            "tags": [ "sensor" ],
            "versions": [
                {
                    "version": "0.1.0",
                    "ref": "v0.1.0",
                    "engine": "~5.5",
                    "requires": [
                        { "name": "UBotCore", "version": "^0.1.0" }
                    ],
                    "enginePlugins": [],
                    "provides": [
                        "Sensor.Pose",
                        "Sensor.Odometry",
                        "Sensor.IMU",
                        "Sensor.Lidar2D",
                        "Sensor.Lidar3D",
                        "Sensor.RGBCamera",
                        "Sensor.DepthCamera",
                        "Sensor.Medium"
                    ]
                },
                {
                    "version": "0.1.1",
                    "ref": "v0.1.1",
                    "engine": "~5.5",
                    "requires": [
                        { "name": "UBotCore", "version": "^0.1.0" }
                    ],
                    "enginePlugins": [],
                    "provides": [
                        "Sensor.Pose",
                        "Sensor.Odometry",
                        "Sensor.IMU",
                        "Sensor.Lidar2D",
                        "Sensor.Lidar3D",
                        "Sensor.RGBCamera",
                        "Sensor.DepthCamera",
                        "Sensor.Medium"
                    ],
                    "binaries": {
                        "5.5": {
                            "Win64": {
                                "url": "https://github.com/AstreoX/uBotSensor/releases/download/v0.1.1/UBotSensor-0.1.1-UE5.5-Win64.zip",
                                "sha256": "bcf53292c0da9880619144a7adb144bee1767c6da64b300844d527b676efe731",
                                "size": 901241
                            }
                        }
                    }
                },
                {
                    "version": "0.1.2",
                    "ref": "v0.1.2",
                    "requires": [
                        { "name": "UBotCore", "version": "^0.1.3" }
                    ],
                    "enginePlugins": [],
                    "provides": [
                        "Sensor.Pose",
                        "Sensor.Odometry",
                        "Sensor.IMU",
                        "Sensor.Lidar2D",
                        "Sensor.Lidar3D",
                        "Sensor.RGBCamera",
                        "Sensor.DepthCamera",
                        "Sensor.Medium"
                    ]
                }
            ]
        },
        {
            "name": "UBotROS",
            "friendlyName": "uBot ROS",
            "description": {
                "en": "ROS 2 over a TCP bridge: sensors, TF, /clock, cmd_vel.",
                "zh-CN": "经 TCP 桥接 ROS 2：传感器、TF、/clock、cmd_vel。"
            },
            "layer": "Adapter",
            "repository": "https://github.com/AstreoX/uBotROS.git",
            "docsUrl": "https://github.com/AstreoX/uBotROS",
            "tags": [ "ros", "ros2", "adapter" ],
            "versions": [
                {
                    "version": "0.1.0",
                    "ref": "v0.1.0",
                    "engine": "~5.5",
                    "requires": [
                        { "name": "UBotCore", "version": "^0.1.0" },
                        { "name": "UBotSensor", "version": "^0.1.0" }
                    ],
                    "enginePlugins": [],
                    "provides": [
                        "ROS.SensorPublishing",
                        "ROS.TF",
                        "ROS.Clock",
                        "ROS.VelocityCommand"
                    ]
                },
                {
                    "version": "0.1.1",
                    "ref": "v0.1.1",
                    "engine": "~5.5",
                    "requires": [
                        { "name": "UBotCore", "version": "^0.1.0" },
                        { "name": "UBotSensor", "version": "^0.1.0" }
                    ],
                    "enginePlugins": [],
                    "provides": [
                        "ROS.SensorPublishing",
                        "ROS.TF",
                        "ROS.Clock",
                        "ROS.VelocityCommand"
                    ],
                    "binaries": {
                        "5.5": {
                            "Win64": {
                                "url": "https://github.com/AstreoX/uBotROS/releases/download/v0.1.1/UBotROS-0.1.1-UE5.5-Win64.zip",
                                "sha256": "47fe10f93ee5805a739a6a81898fadc575b46d6960eb3aa11ca14d3e89ec1063",
                                "size": 745093
                            }
                        }
                    }
                },
                {
                    "version": "0.1.2",
                    "ref": "v0.1.2",
                    "engine": "~5.5",
                    "requires": [
                        { "name": "UBotCore", "version": "^0.1.2" },
                        { "name": "UBotSensor", "version": "^0.1.0" }
                    ],
                    "enginePlugins": [],
                    "provides": [
                        "ROS.SensorPublishing",
                        "ROS.TF",
                        "ROS.Clock",
                        "ROS.VelocityCommand",
                        "ROS.AttitudeCommand",
                        "ROS.MotorCommand"
                    ],
                    "binaries": {
                        "5.5": {
                            "Win64": {
                                "url": "https://github.com/AstreoX/uBotROS/releases/download/v0.1.2/UBotROS-0.1.2-UE5.5-Win64.zip",
                                "sha256": "991f1100eff4c56c75a69dd0d1db157fba6fb04258debf22d058278d055269df",
                                "size": 821162